{
  "$schema": "bopen://schemas/governance/pg-g0-authority-docket/0.2.0-draft",
  "docket_id": "PG-G0-AUTH-001",
  "version": "0.2.0-draft",
  "status": "pending_human_decisions",
  "owner_authority": "Engineering Authority",
  "updated_at": "2026-07-22T23:45:00+07:00",
  "expires_at": "2026-08-21T00:00:00+07:00",
  "repository_binding": {
    "commit_sha": "26bea090c0aca14f1337c4be1a146fd48bb1f626",
    "tree_sha": "8789c5e70c2ce87298928d4d02add7ffe5867402",
    "branch": "operator/PG-G0-signing-pass-1",
    "repository_ref": "bstBizEra/bopen"
  },
  "governing_artifacts": [
    {"artifact_id":"BOPEN-GOV-001","version":"0.1","status":"Draft","artifact_ref":"docs/00-governance/BOPEN-GOV-001-DRAFT.md","sha256":"53f13da99eda57f7c6c9cd817f40666287c6dd774805d26f666f96648a1f422e"},
    {"artifact_id":"BOPEN-GOAL-001","version":"0.2","status":"Draft","artifact_ref":"docs/01-product/BOPEN-GOAL-001-DRAFT.md","sha256":"31cd060b393c77e637e7e841280d87c0e9d358f616950c1745e70a1303a0857c"},
    {"artifact_id":"DEC-0007","version":"0.1","status":"Proposed","artifact_ref":"docs/decisions/DEC-0007.md","sha256":"105dc30d8c5c013d90d91964efa5bf32e9da1e0d11199c800d1d248c2a2c1f6c"},
    {"artifact_id":"DEC-0010","version":"0.1","status":"Proposed","artifact_ref":"docs/decisions/DEC-0010.md","sha256":"0df762a9dcafd3580c24662ca851507853a00f869eb86ef09e4950067ae205cd"},
    {"artifact_id":"DEC-0012","version":"0.1","status":"Partially disposed","artifact_ref":"docs/decisions/DEC-0012.md","sha256":"10023fe43191d702a0703b30c820ce6ea572209165481054239eeca4f9c66325"},
    {"artifact_id":"DEC-0013","version":"0.1","status":"Proposed","artifact_ref":"docs/decisions/DEC-0013.md","sha256":"04156eb4cb7d3b4580363cf5ecc1e875c343631c59c1d654510f5ac6e796be27"},
    {"artifact_id":"GOV-P0-01","version":"0.1","status":"Proposed","artifact_ref":"docs/work-packages/GOV-P0-01.md","sha256":"9c1f69b16e5dc48969f5ea88288114da4f78fe39816ef9d91d05d62a4a65eaf6"},
    {"artifact_id":"GOV-P0-02","version":"0.1","status":"Accepted","artifact_ref":"docs/work-packages/GOV-P0-02.md","sha256":"20fd63289022a51318b07ee9f4c531bed49e0ca401148df1a4a7c30e3c0840df"},
    {"artifact_id":"GOV-P0-03","version":"0.1","status":"Accepted; activation pending","artifact_ref":"docs/work-packages/GOV-P0-03.md","sha256":"1a42d342aea9ab91dbfb689e0263b83e46215c55100f6f25c1d1790505594d9d"},
    {"artifact_id":"GOV-P0-04","version":"0.1","status":"Proposed","artifact_ref":"docs/work-packages/GOV-P0-04.md","sha256":"f9d9384f9640aa23204f3b520d5aaa6cafa67ef336c6721e7a75554757489878"},
    {"artifact_id":"EVD-GOV-001","version":"0.1","status":"Draft technical evidence","artifact_ref":"docs/evidence/EVD-GOV-001-program-g0-controls.md","sha256":"29c965c3a629449e7722ecdad15cbafb2beed6ec6693e7a40d747a17d1adff8f"},
    {"artifact_id":"EVD-GOV-002","version":"0.1","status":"Draft maker evidence","artifact_ref":"docs/evidence/EVD-GOV-002-pg-g0-authority-docket.md","sha256":"4cafd91d22dbf70ecbd9bf91d1e679d18da8832d04add28d865e0d69edf4ffaa"},
    {"artifact_id":"EVD-GOV-003","version":"0.1","status":"Draft technical evidence","artifact_ref":"docs/evidence/EVD-GOV-003-root-control-surfaces.md","sha256":"3fcb548b990cf6497008692b87813fe99d636ef30ee0e1b396230c6e409495f5"},
    {"artifact_id":"EVD-GOV-004","version":"0.1","status":"ACCEPT_EXACT_SHA","artifact_ref":"docs/evidence/EVD-GOV-004-gov-p0-03-independent-verification.md","sha256":"ff2fb11f02d80a61ddf5fd368c28a613a38e575393794bae7b71496569504bf9"},
    {"artifact_id":"EVD-GOV-005","version":"0.1","status":"REJECT for 203ed05","artifact_ref":"docs/evidence/EVD-GOV-005-gov-p0-04-independent-review.md","sha256":"f6d14750289d6a4bf0fbcbe3817a89d95e869ccb7d0a43b93eb2914cf693b7a2"},
    {"artifact_id":"EVD-GOV-006","version":"0.1","status":"ACCEPT_EXACT_SHA for d7d8699","artifact_ref":"docs/evidence/EVD-GOV-006-gov-p0-04-corrective-candidate-review.md","sha256":"d8415433cd381c3a6e370ecc41d2be966bfcae765c11b97da8aa07f1a2885639"},
    {"artifact_id":"AUTHORITY-MATRIX-V0.2-PROPOSAL","version":"0.2.0-draft","status":"draft","artifact_ref":"docs/00-governance/AUTHORITY-MATRIX-0.2.0-PROPOSAL.json","sha256":"14671ba675d47dd5aa992bc2b56c2d5dfb10cc6f39ffe48c9be72e8dd8338a24"},
    {"artifact_id":"AUTHORITY-IDENTITY-REGISTER","version":"0.1.0","status":"approved","artifact_ref":"docs/00-governance/registers/AUTHORITY-IDENTITY-REGISTER.json","sha256":"3418736ff45a6a56f2d63d251fa98181f42ddd3d3bb8f42a894146c20ee313f4"},
    {"artifact_id":"GOAL-REGISTER","version":"0.1.0-draft","status":"draft","artifact_ref":"docs/00-governance/registers/GOAL-REGISTER.json","sha256":"af1008f1b4c3f42b684bdf860bf7fd6bd3310528163240b0bcf77f0cb1a86b45"},
    {"artifact_id":"AGENT-REGISTER","version":"0.1.0-draft","status":"draft","artifact_ref":"docs/00-governance/registers/AGENT-REGISTER.json","sha256":"9b91b61a846d5f20bec4489681591ad5f005debd7ff94f798f3aa4287600202c"},
    {"artifact_id":"MODULE-REGISTER","version":"0.1.0-draft","status":"draft","artifact_ref":"docs/00-governance/registers/MODULE-REGISTER.json","sha256":"9c3e77752d7aeaf9a535f552d15719c66fba591f822eadeabd21400500930cb0"},
    {"artifact_id":"SKILL-REGISTER","version":"0.1.0-draft","status":"draft","artifact_ref":"docs/00-governance/registers/SKILL-REGISTER.json","sha256":"28575ce02c54a897b3f1f9d235524362806fe74760b650a82b4bc3604304ba23"},
    {"artifact_id":"SCHEDULE-REGISTER","version":"0.1.0-draft","status":"draft","artifact_ref":"docs/00-governance/registers/SCHEDULE-REGISTER.json","sha256":"4232b66aff2eaf16fb26dd9286c7d41bc0632dfa0d485733e12c1f9fac29a0ef"},
    {"artifact_id":"TECHNOLOGY-DECISION-ASSIGNMENTS","version":"0.1.0-draft","status":"draft","artifact_ref":"docs/00-governance/registers/TECHNOLOGY-DECISION-ASSIGNMENTS.json","sha256":"5e5bf64ec40b6312a5a815356484e97bce947312ea18dc5b91897da4ee524a3e"},
    {"artifact_id":"ROOT-ROADMAP","version":"0.1","status":"Draft/Inactive","artifact_ref":"Roadmap.md","sha256":"9039fe3a2d1f77cd8a30c050bbcb2d0c29031ce979ecef380c307f548802f1a8"},
    {"artifact_id":"ROOT-MASTER-STANDARDS","version":"0.1","status":"Draft/Inactive","artifact_ref":"Master_Standards.md","sha256":"b1d837a156e68bd2cab0359804b4294c855f52187fd2d3f1eaf3f6cbfe8ede06"},
    {"artifact_id":"ROOT-PROGRESS","version":"0.1","status":"Draft/Inactive","artifact_ref":"Progress_Log.md","sha256":"11c688f8b0c44deeeff81da39564e0fc30ee1bdf090937532203cfed9887cd7b"},
    {"artifact_id":"ROOT-BACKLOG","version":"0.1","status":"Draft/Inactive","artifact_ref":"Backlog.md","sha256":"425e7f049f012a81ca0f687824bcd0fa43ea898efce17c6592bf51542e9ce44c"},
    {"artifact_id":"ROOT-RECAP","version":"0.1","status":"Draft/Inactive","artifact_ref":"Recap_Today.md","sha256":"76e64a6ae9f84e7fa4417edd098addb869c710a56dbee47488eaffb3238a7b49"},
    {"artifact_id":"SIGNING-PASS-1","version":"0.1","status":"partially disposed","artifact_ref":"docs/00-governance/signing/SIGNING-PASS-1.md","sha256":"2fe927e728c1be060a413b5be096007455cef81e4a3bb9028fddab316b924407"}
  ],
  "binding_inventory": {
    "inventory_ref": "docs/00-governance/authority-dockets/PG-G0-AUTH-001-V0.2-BINDING-INVENTORY.json",
    "inventory_id": "PG-G0-AUTH-001-V0.2-BINDINGS",
    "substrate_commit_sha": "26bea090c0aca14f1337c4be1a146fd48bb1f626",
    "substrate_tree_sha": "8789c5e70c2ce87298928d4d02add7ffe5867402",
    "record_count": 34
  },
  "authority_source": {
    "matrix_id": "PG-REG-AUTHORITY-001",
    "artifact_ref": "docs/00-governance/AUTHORITY-MATRIX-0.2.0-PROPOSAL.json",
    "adoption_target_ref": "docs/00-governance/registers/AUTHORITY-MATRIX.json",
    "version": "0.2.0-draft",
    "status": "draft",
    "sha256": "14671ba675d47dd5aa992bc2b56c2d5dfb10cc6f39ffe48c9be72e8dd8338a24",
    "effective": false
  },
  "technical_review": {
    "candidate_commit_sha": null,
    "candidate_tree_sha": null,
    "maker": {"actor_kind":"AGENT","identity_ref":"BST-Codex-Motor","role":"Orchestrator Agent","registration_ref":null,"session_ref":null},
    "checker": null,
    "independence_asserted": false,
    "verdict": "PENDING",
    "reviewed_at": null,
    "evidence_refs": []
  },
  "prepared_dispositions": [
    {"disposition_id":"PG-G0-PREP-001","batch_item":"B2","action_id":"APPROVE_GOVERNANCE_BASELINE","subject":{"artifact_id":"BOPEN-GOV-001","version":"0.1","artifact_ref":"docs/00-governance/BOPEN-GOV-001-DRAFT.md","sha256":"53f13da99eda57f7c6c9cd817f40666287c6dd774805d26f666f96648a1f422e","commit_sha":"26bea090c0aca14f1337c4be1a146fd48bb1f626","tree_sha":"8789c5e70c2ce87298928d4d02add7ffe5867402"},"requested_state":"APPROVED","accountable_authority_role":"Engineering Authority","required_concurrence":["Product Authority","Architecture Authority","Security Authority","Data Authority"],"authority_actor":null,"disposition":"PENDING","decided_at":null,"expires_at":"2026-08-21T00:00:00+07:00","decision_ref":null,"evidence_refs":[],"effective":false},
    {"disposition_id":"PG-G0-PREP-002","batch_item":"B2","action_id":"APPROVE_PROGRAM_REGISTERS","subject":{"artifact_id":"AUTHORITY-MATRIX-V0.2-PROPOSAL","version":"0.2.0-draft","artifact_ref":"docs/00-governance/AUTHORITY-MATRIX-0.2.0-PROPOSAL.json","sha256":"14671ba675d47dd5aa992bc2b56c2d5dfb10cc6f39ffe48c9be72e8dd8338a24","commit_sha":"26bea090c0aca14f1337c4be1a146fd48bb1f626","tree_sha":"8789c5e70c2ce87298928d4d02add7ffe5867402"},"requested_state":"APPROVED","accountable_authority_role":"Engineering Authority","required_concurrence":["Product Authority","Architecture Authority","Security Authority","Data Authority"],"authority_actor":null,"disposition":"PENDING","decided_at":null,"expires_at":"2026-08-21T00:00:00+07:00","decision_ref":null,"evidence_refs":[],"effective":false},